<!ELEMENT students (student+)>
<!ELEMENT student (name?, age, department)>
<!ATTLIST student id ID #REQUIRED>
<!ELEMENT name (#PCDATA)>
<!ELEMENT age (#PCDATA)>
<!ELEMENT department (#PCDATA)>